id,title,score,upvote_ratio,author,num_comments,created_utc,selftext,permalink
1kp1iuq,Foodspring Proteinballs,9,0.85,Nice_Specialist390,5,1747511100.0,Die Packung ist weniger als 50% gefüllt.,https://reddit.com/r/MogelPackung/comments/1kp1iuq/foodspring_proteinballs/
1kp0j0w,Damhus Corndogs,43,0.94,roundingTop,19,1747508518.0,"Wir haben uns Corndogs bei Edeka gegönnt und als ich die Packung aufgemacht habe dachte ich die verarschen mich. 😆
Das Produkt ist auf dem Bild doch mindestens doppelt so groß wie in der Packung? 
Aufgespießt ist ein Mini-Würstchen mit Teigmantel und einem riesigen Spieß. 🫠
",https://reddit.com/r/MogelPackung/comments/1kp0j0w/damhus_corndogs/
1koy9v8,➖XXL schnitzel,53,0.73,AntonioHench1,44,1747502611.0,"Esse eh kein schwein, juckt mir nich ",https://reddit.com/r/MogelPackung/comments/1koy9v8/xxl_schnitzel/
1kovsn4,Grüße aus Bermuda!,4,0.64,SaltyBottles,2,1747496091.0,😂,https://reddit.com/r/MogelPackung/comments/1kovsn4/grüße_aus_bermuda/
1kounou,"1 Liter bzw. 2,5 Liter Farbe gekauft und nur 0,9 Liter bzw. 2,375 Liter erhalten??",165,0.96,weizenmehl3,87,1747493093.0,"Habe online ziemlich viel Farbe gekauft und offensichtlich 1L bzw. 2,5L Behälter bestellt. Habe schon einiges verstrichen bis mir aufgefallen ist, dass in keinem der Behälter wirklich die bestellte Menge enthalten ist. Über meine ganze bestellte Farbe hinweg fehlen mir ca. 500mL..
Kundenservice wurde eben kontaktiert aber da muss ich wohl bis Montag warten auf eine Rückmeldung. ",https://reddit.com/r/MogelPackung/comments/1kounou/1_liter_bzw_25_liter_farbe_gekauft_und_nur_09/
1kosdo9,Insgesamt maximal eine Cherrytomate auf meinen Tomate-Mozzarella Pizzen,56,0.93,MaksDerDags,22,1747486663.0,"Eine Pizza hatte zwei Scheiben, die andere nur eine. Sieht auf dem Bild ganz anders aus :( ",https://reddit.com/r/MogelPackung/comments/1kosdo9/insgesamt_maximal_eine_cherrytomate_auf_meinen/
1koodk4,Giotto mit mehr als 50% Luft in der Verpackung.,49,0.74,Deep-Hippo8968,59,1747471496.0,"Mehr Luft geht fast gar nicht, 9x3 Giotto sind drin.",https://reddit.com/r/MogelPackung/comments/1koodk4/giotto_mit_mehr_als_50_luft_in_der_verpackung/
1konwii,"Ganz sicher: 1 TB für 10,29 €",0,0.31,kapege,7,1747469465.0,"Und 256 Terabyte ist auch ""dezent"" übertrieben.",https://reddit.com/r/MogelPackung/comments/1konwii/ganz_sicher_1_tb_für_1029/
1konjtg,"Bin ja nicht der beste in Mathe, aber wie soll ich denn 33 Portionen à 15 g aus einem 350 g Glas rausbekommen?",175,0.97,Mahaito,50,1747467961.0,,https://reddit.com/r/MogelPackung/comments/1konjtg/bin_ja_nicht_der_beste_in_mathe_aber_wie_soll_ich/
1kon3yh,Dubai chocolate,195,0.84,Zyrrus,65,1747466164.0,Schmeckt übrigens genau wie Kinder Corny. ,https://reddit.com/r/MogelPackung/comments/1kon3yh/dubai_chocolate/
