id,title,score,upvote_ratio,author,num_comments,created_utc,selftext,permalink
1lkz24v,Jetzt auch bei Gemüsebrühe: 20% weniger Inhalt!,0,0.31,Rhodianer,6,1750941460.0,"Gerade aufgemacht, aber ein Fabrikmitarbeiter hat sich wohl schon eine Brühe gemacht",https://reddit.com/r/MogelPackung/comments/1lkz24v/jetzt_auch_bei_gemüsebrühe_20_weniger_inhalt/
1lkrc1h,Keine Schokolade?!?,0,0.39,Far_Squirrel_6148,18,1750913309.0,"Meine erste Begegnung mit ChoViva, der kakaofreien Schokoladenalternative. Ich hätte nicht für möglich gehalten dass es sowas gibt. Dafür schmeckt es erstaunlich gut, aber es bleibt halt diese Befriedigung aus, die man in der Schokolade sucht. So macht das einfach keinen Spaß. ",https://reddit.com/r/MogelPackung/comments/1lkrc1h/keine_schokolade/
1lkey07,Die haben in der Fabrik aus meiner Cola gesoffen!,29,0.74,Sweet-Highlight3205,25,1750879416.0,,https://reddit.com/r/MogelPackung/comments/1lkey07/die_haben_in_der_fabrik_aus_meiner_cola_gesoffen/
1lkbrht,Haribo,89,0.92,Agreeable-Slip-884,26,1750872178.0,Von 37 cm Verpackung sind 54 % Luft. Toll starke Leistung Hans Riegel. ,https://reddit.com/r/MogelPackung/comments/1lkbrht/haribo/
1lijgoh,Mogelpackung bei der Schanzenbäckerei - Knusperhähnchen-Schnitzelbrötchen nur noch halb so gut? 😡,3,0.58,Cheap-County-1852,7,1750692238.0,"Die Schanzenbäckerei Hamburg hat anscheinend klammheimlich ihr Knusperhähnchen-Schnitzelbrötchen geändert – und zwar nicht zum Besseren!
Normalerweise waren da ja immer zwei Hähnchenschnitzel-Teile drin. Heute dachte ich mir, gönn dir mal wieder eins. In der Auslage sah noch alles normal aus. Aber als ich das Brötchen umgedreht habe, kam die Ernüchterung:
Statt zwei vollwertigen Schnitzeln ist da nur noch ein Schnitzel, das halbiert wurde! Und das Beste daran: Damit ist auch nur noch eine Seite des Teils Paniert. Das ist doch eine absolute Frechheit und eine klare Mogelpackung! Man zahlt den gleichen Preis für deutlich weniger Qualität und Quantität.",https://reddit.com/r/MogelPackung/comments/1lijgoh/mogelpackung_bei_der_schanzenbäckerei/
1lif8hh,Zählt das?,4,0.6,Outrageous_Bid1167,4,1750681527.0,"Dr. Oetker Vitalis Müsli, 

Gleicher Karton, weniger Inhalt Aber immerhin schreiben sie es drauf, zählt dass dann als Mogelpackung? ",https://reddit.com/r/MogelPackung/comments/1lif8hh/zählt_das/
1licl2b,Jetzt reicht's aber hier,1585,0.98,Luis_9466,79,1750672557.0,,https://reddit.com/r/MogelPackung/comments/1licl2b/jetzt_reichts_aber_hier/
1lib45i,Hobnob Flapjacks,3,0.55,Embarrassed-War-5957,5,1750666719.0,,https://reddit.com/r/MogelPackung/comments/1lib45i/hobnob_flapjacks/
1lhy2zw,Homann weniger Inhalt,31,0.75,Bitter-Tax-6683,18,1750624890.0,"Von 450 auf 430 mal für 2,69 Euro. ",https://reddit.com/r/MogelPackung/comments/1lhy2zw/homann_weniger_inhalt/
1lhfyqc,Süßstoff verdünnt?,1,0.6,Mojito_92,2,1750568845.0,"Ich habe das Gefühl, der flüssige Süßstoff von Kaufland (Cyclamat und Sacharin) wurde vor 1-2 Jahren verdünnt. Früher brauchte ich deutlich weniger davon. Könnt ihr das bestätigen?
Hat jemand zufällig eine alte Flasche und könnte mal nachschauen was hinten zur Süßkraft draufsteht?  (X Tropfen entsprechen 1 TL Zucker)",https://reddit.com/r/MogelPackung/comments/1lhfyqc/süßstoff_verdünnt/
1lh0kxp,ja! Wiener Würstchen,0,0.42,Beezybandgang,19,1750523377.0,,https://reddit.com/r/MogelPackung/comments/1lh0kxp/ja_wiener_würstchen/
1lgu7hg,Ist das schon Diebstahl?,254,0.98,Tightisto,34,1750504756.0,"Schon beim direkten erblicken gesehen, dass das keine 500g sein können.",https://reddit.com/r/MogelPackung/comments/1lgu7hg/ist_das_schon_diebstahl/
1lgsovm,Räucherlachs 93g statt 100g,235,0.8,DaangD,87,1750498725.0,"Hallo zusammen, ich hatte diese Woche große Lust auf Räucherlachs gehabt, als ich die tolle Packung gesehen habe. Nach dem öffnen und wiegen war ich überrascht. Die Unterlage wiegt 8g. Ich denke, dass ist ein Fall für Mogelpackung. ",https://reddit.com/r/MogelPackung/comments/1lgsovm/räucherlachs_93g_statt_100g/
1lgd8sn,"Bemerkt bei mir auf der Arbeit, zählt es?",0,0.2,Significant-Use-1940,4,1750448913.0,"Ja, Gramm stehen darauf, aber kommt schon ",https://reddit.com/r/MogelPackung/comments/1lgd8sn/bemerkt_bei_mir_auf_der_arbeit_zählt_es/
1lg55wr,PU-Schaum,2,0.55,_AP0PL3X_,2,1750429142.0,"Ich war heute in der freudigen Situation PU-Schaum kaufen zu müssen und es hat echt eine Weile gedauert.

Vorweg. Alle Dosen sind wirklich annähernd gleich, bis eben auf die Größe. Jede der Packungen mit dem Label „vielseitig“ hat die gleichen Beschriftungen, die gleichen Eigenschaften. 

Bild 1 zeigt 600ml (500ml+20%) für 6€
Bild 2 zeigt die großen Dosen 750ml für 14€
und 500ml für 12€.

Es ist wirklich 3x das selbe Produkt. Zumindest sehe ich keinen Unterschied. Alle 3 sind in der Klasse B2 und besitzen vom Hersteller die gleiche Charaktertabelle. Gleiche Stabilität, Festigkeit etc…

Ich stand ungelogen 30min vor dem Regal und hab den Unterschied gesucht. 

Vielleicht jetzt nicht die klassische Mogelpackung, aber ich wusste nicht welches sub besser geeignet wäre ",https://reddit.com/r/MogelPackung/comments/1lg55wr/puschaum/
1lg0gw8,MAOAM fängt auch damit an,8,0.59,hansihub,11,1750414778.0,,https://reddit.com/r/MogelPackung/comments/1lg0gw8/maoam_fängt_auch_damit_an/
1lfnetp,"Rewe - ""näher geht's nicht, frischer geht's nicht"" Werbung",193,0.85,El_Lasagno,55,1750370633.0,Ja ihr mich auch... Zwiebeln aus Neuseeland. ,https://reddit.com/r/MogelPackung/comments/1lfnetp/rewe_näher_gehts_nicht_frischer_gehts_nicht/
1lfa9xa,Aso,103,0.96,StunningCook4919,40,1750338173.0,"Wollte es probieren, weil es neu ist und da fehlt gefühlt einfach die Hälfte haha",https://reddit.com/r/MogelPackung/comments/1lfa9xa/aso/
1lf8n7a,50% Luft,85,0.9,alanger7,54,1750333250.0,Da passen locker 8 Patties rein 👀,https://reddit.com/r/MogelPackung/comments/1lf8n7a/50_luft/
1lekjvu,Kirchliche Mogelpackung,91,0.86,maestro300,34,1750261714.0,"Ich hoffe das zählt
1,50€ hat dies bisschen Kerzenwachs gekostet ",https://reddit.com/r/MogelPackung/comments/1lekjvu/kirchliche_mogelpackung/
1leimh9,Positiv: Zu viel Volumen muss nicht sein,3,0.67,_Red_User_,5,1750257113.0,"Auf einer Verpackung von Mandeln in Scheiben gesehen. Ich habe leider das Perforationsloch nicht gefunden, aber fand diese Information sehr positiv. Eventuell wird ja noch die Verpackung kleiner. Ich vermute aber eher, dass die Packungsgröße universell eingesetzt wird und daher nicht verändert wird (zumindest nicht für dieses Produkt).",https://reddit.com/r/MogelPackung/comments/1leimh9/positiv_zu_viel_volumen_muss_nicht_sein/
1lefpk7,Ich ruf gleich den Verbraucherschutz,755,0.97,Specialist-Echo-5147,60,1750249419.0,,https://reddit.com/r/MogelPackung/comments/1lefpk7/ich_ruf_gleich_den_verbraucherschutz/
1ldj0b9,"4,7 Stücken Wurst. Die Sauce in einem Stück auf dem anderen Ende der ""Pizza"".",54,0.9,_h0l_,31,1750153767.0,,https://reddit.com/r/MogelPackung/comments/1ldj0b9/47_stücken_wurst_die_sauce_in_einem_stück_auf_dem/
1ldg9yr,Zählt das?,985,0.98,GiveMe1Dollar,126,1750142571.0,,https://reddit.com/r/MogelPackung/comments/1ldg9yr/zählt_das/
1lczt61,Zwei Mogeleien auf einen Streich,96,0.87,dieguteTee,45,1750096649.0,"Eben im Rewe gesehen: die Packungen auf dem großen Angebotsschild beinhalten 200g und die restlichen nur 165g. Da beide Packungen exakt gleich groß sind und eben gleich teuer, ist uns das nur durch Zufall aufgefallen. Es gab nämlich nur noch eine einzige Packung mit 200g Inhalt. Und ja immerhin, das +35% gratis stimmt somit.  ",https://reddit.com/r/MogelPackung/comments/1lczt61/zwei_mogeleien_auf_einen_streich/
1lc6rws,Crunchips Burrito Style nur 130g statt 150g?,2,0.63,Erik_De,5,1750010706.0,"Letzte Woche hatte Edeka Crunchips im Angebot, und ich habe verschiedene Sorten gekauft alle zum Angebotspreis.

Dabei ist mir dann erst Zuhause aufgefallen dass die Sorte Crunchips Burrito Style im Gegensatz zu andern Sorten wie Western Style oder Cheese and Onion 20g weniger Inhalt hat  ohne daß auf der Zutatenliste außer anderen Aromen groß ein Unterschied erkennbar ist.

Warum sind ausgerechnet bei dieser Sorte weniger drin?",https://reddit.com/r/MogelPackung/comments/1lc6rws/crunchips_burrito_style_nur_130g_statt_150g/
1lc6243,Rewe “ja!” Cerealien,0,0.48,Tillapontana,16,1750008939.0,"Beide haben den gleichen Preis, gleiche Verpackungsgröße und aber unterschiedliche Gewichte. Das liegt aber nicht an der Sorte, da die beiden (pro Stück) gleich schwer und groß sind. Handelt es sich hier dann um eine Mogelpackung?",https://reddit.com/r/MogelPackung/comments/1lc6243/rewe_ja_cerealien/
1lbvtex,Jetzt mit mehr Inhalt..,59,0.87,Electrical-Bedroom-6,11,1749977726.0,"Bin mir nicht sicher, ob das hier her passt, aber links die neue Verpackung und rechts die Alte. Neu hat 50 Ml mehr Inhalt, dafür aber jetzt billigere Inhaltsstoffe, mehr Parfum und weniger hautverträglich. Schade, war mein Lieblingsduschgel, werde mich jetzt nach einem Neuen umgucken müssen.",https://reddit.com/r/MogelPackung/comments/1lbvtex/jetzt_mit_mehr_inhalt/
1lba1qm,Der Kuchen war so schon überteuert…,100,0.91,InternationalFrend,43,1749911438.0,,https://reddit.com/r/MogelPackung/comments/1lba1qm/der_kuchen_war_so_schon_überteuert/
1lb5ozd,Bin mal auf die „das ist technisch bedingt“ Kommentare gespannt,17,0.68,Anon_Afg_Ind,24,1749897532.0,,https://reddit.com/r/MogelPackung/comments/1lb5ozd/bin_mal_auf_die_das_ist_technisch_bedingt/
1lag9sl,Mars Mogelpackung,153,0.91,Ok_Letter_5672,41,1749822204.0,,https://reddit.com/r/MogelPackung/comments/1lag9sl/mars_mogelpackung/
1la57ss,Duracell,109,0.67,Imaginary_Wish_8801,77,1749782835.0,,https://reddit.com/r/MogelPackung/comments/1la57ss/duracell/
1l9sdrp,Nicht Mal halb so groß wie die Verpackung,226,0.84,Roy_Ellison,45,1749749214.0,,https://reddit.com/r/MogelPackung/comments/1l9sdrp/nicht_mal_halb_so_groß_wie_die_verpackung/
1l9mn60,Schon etwas viel Verpackung verschwendet,36,0.69,kk653,44,1749735317.0,,https://reddit.com/r/MogelPackung/comments/1l9mn60/schon_etwas_viel_verpackung_verschwendet/
1l8ra7n,Maxi Pack gleich mal um 8 Tabs geschrumpft,168,0.93,Iliketoeat_0605,42,1749644622.0,,https://reddit.com/r/MogelPackung/comments/1l8ra7n/maxi_pack_gleich_mal_um_8_tabs_geschrumpft/
1l8r0na,Belegtes Brötchen,151,0.93,Extreme-Long7941,41,1749643842.0,"Naja, die Bilder sprechen für sich.
KrissKross, hänchenbratling mit ""Salat""
Preis müsste so knapp über 4 euro liegen
Bei einem Edeka im Umland Hamburgs",https://reddit.com/r/MogelPackung/comments/1l8r0na/belegtes_brötchen/
1l868hf,„Neuer Inhalt 120g“ ist das neue „Jetzt 5g weniger“,79,0.87,intentionalAnon,41,1749579817.0,"Ich habe gerade noch mal in der Edeka App nachgekuckt, was mir meine Frau aufgeschrieben hat. Darin stand noch 125 g (strichcode gescannt vom alten Produkt).",https://reddit.com/r/MogelPackung/comments/1l868hf/neuer_inhalt_120g_ist_das_neue_jetzt_5g_weniger/
1l7vek1,MAX für den Popo.,67,0.83,wolfjazz93,19,1749551825.0,,https://reddit.com/r/MogelPackung/comments/1l7vek1/max_für_den_popo/
1l6nfk3,Mein Eisriegel ist zu einem Drittel mit Luft gefüllt.,132,0.89,fn-VANADIUM,29,1749418148.0,,https://reddit.com/r/MogelPackung/comments/1l6nfk3/mein_eisriegel_ist_zu_einem_drittel_mit_luft/
1l6m99i,Sonst hat sich da nichts geändert. Schutz hat sich einfach erhöht,32,0.79,SilberrueckenSigma,34,1749415078.0,,https://reddit.com/r/MogelPackung/comments/1l6m99i/sonst_hat_sich_da_nichts_geändert_schutz_hat_sich/
1l6h7qm,Jacobs Krönung Instantkaffee 15.00€ - Supermarkt in Chile,0,0.31,No-Payment-9574,11,1749402458.0,"Hallo,

Bei uns in Chile wird derzeit dieser ""Kaffee"" für 15 Euro umgerechnet im Supermarkt verkauft. Weiß jemand was dieses Produkt in Deutschland kostet? ",https://reddit.com/r/MogelPackung/comments/1l6h7qm/jacobs_krönung_instantkaffee_1500_supermarkt_in/
1l6cxb3,Wo die anderen 6 Riegel?,250,0.85,Progamer40421,80,1749391457.0,Hatte schon einen gegessen.,https://reddit.com/r/MogelPackung/comments/1l6cxb3/wo_die_anderen_6_riegel/
1l5ppdp,"Fleisch mit Wasser aufspritzen, damit es grösser und schwerer wird",1,0.53,Nico_Kx,10,1749315872.0,,https://reddit.com/r/MogelPackung/comments/1l5ppdp/fleisch_mit_wasser_aufspritzen_damit_es_grösser/
1l5knq4,Inhalt reicht knapp bis zum Sichtfenster,14,0.67,Mundane-Register-879,5,1749302326.0,"Ich habe ja schon wirklich einiges gesehen - aber was hat sich Violife hierbei gedacht?

Die Packung ist zu mehr als 60% leer, deutlich größer als alle vergleichbaren Produkte bei 20-30g weniger Inhalt - und zu guter letzt trotzdem teurer. Nicht mal das Sichtfenster in die Verpackung ist mit Inhalt gefüllt.

Absolut verrückt!",https://reddit.com/r/MogelPackung/comments/1l5knq4/inhalt_reicht_knapp_bis_zum_sichtfenster/
1l4mvju,Wenigstens ist es noch halb voll,27,0.71,maguz94,9,1749196691.0,,https://reddit.com/r/MogelPackung/comments/1l4mvju/wenigstens_ist_es_noch_halb_voll/
1l3scc5,"""Vorteilspackung"" Butter bei Rewe",335,0.96,8192K,100,1749105356.0,"Wer rechnen (oder hier auch lesen) kann, ist klar im Vorteil!

Werde nie mehr die große ""Vorteilspackung"" kaufen.",https://reddit.com/r/MogelPackung/comments/1l3scc5/vorteilspackung_butter_bei_rewe/
1l34zu1,Mogeletikett bei Edeka Südwest,0,0.24,NiNiNaNaNuNu420,8,1749042138.0,"Keine Mogelpackung sondern ein Mogeletikett, hoffe das passt hier trotzdem.

Jetzt geht's bei Edeka (Südwest) richtig los mit der App Verarsche.
Nur weil die Buns für App Kunden reduziert sind suggeriert man den restlichen Kunden über das rote Etikett ein Angebot.
Der Normal-Preis der Buns ist 1,99€.",https://reddit.com/r/MogelPackung/comments/1l34zu1/mogeletikett_bei_edeka_südwest/
1l2zywp,Danke für Speck/Fett,15,0.62,superwinni2,19,1749024314.0,Ein Glück ist immerhin bisschen rotes Fleisch dabei...,https://reddit.com/r/MogelPackung/comments/1l2zywp/danke_für_speckfett/
1l2yiml,Skyr Scam,0,0.4,No_Resolve_4102,6,1749018416.0,"Ich kaufe regelmäßig Skyr von Lidl, und hatte es kein einziges Mal dass es 500 gramm waren, es sind immer zwischen 470 und 480 Gramm.",https://reddit.com/r/MogelPackung/comments/1l2yiml/skyr_scam/
1l2lzy2,Aber wenigstens ist der Kuchen ganz,139,0.95,Anon_Afg_Ind,29,1748981452.0,,https://reddit.com/r/MogelPackung/comments/1l2lzy2/aber_wenigstens_ist_der_kuchen_ganz/
1l2lj6y,Dedüm,17,0.73,sethvanrinsum,7,1748980391.0,,https://reddit.com/r/MogelPackung/comments/1l2lj6y/dedüm/
1l1o4jy,War mir klar…,31,0.86,PipMerRox,8,1748885449.0,…aber die vom Lidl waren immer noch ausverkauft…,https://reddit.com/r/MogelPackung/comments/1l1o4jy/war_mir_klar/
1l1iniz,Was kostet dieser Kaffee in Deutschland?,20,0.78,No-Payment-9574,23,1748872504.0,"Hallo, 

Kann mir jemand sagen was dieser Kaffee (oder ähnlich) in Deutschland kostet? 

In Chile im Supermarkt kosten 170g 7,40€ umgerechnet. Es ist der Günstigste, den ich finden konnte. Filterkaffee kostet hier knapp 11€ für 500g und ich habe keine Kaffeemaschine.

Dankeschön ",https://reddit.com/r/MogelPackung/comments/1l1iniz/was_kostet_dieser_kaffee_in_deutschland/
1l1hb24,Die wissen genau was sie da tun,255,0.97,Evening-King-2550,25,1748868941.0,,https://reddit.com/r/MogelPackung/comments/1l1hb24/die_wissen_genau_was_sie_da_tun/
1l1evk2,"Some hotels use ""waste reducing"" soap bars to eliminate the unused center.",0,0.3,Ok-Fault-8956,12,1748861317.0,,https://reddit.com/r/MogelPackung/comments/1l1evk2/some_hotels_use_waste_reducing_soap_bars_to/
1l0ltot,"Und ich hab mich zuerst gefragt, warum ich von der unteren Packung schon zwei raus genommen hatte..",255,0.91,Red-Cakes,98,1748774017.0,Von wegen xxl Pack (nur jeweils drei Klingen oben und unten statt fünf). Und gescheit halten die Klingen auch nicht und werden schnell stumpf.,https://reddit.com/r/MogelPackung/comments/1l0ltot/und_ich_hab_mich_zuerst_gefragt_warum_ich_von_der/
1kzuejb,"2,29€ für vier von diesen Mini-Dingern",449,0.97,ssaltae_,50,1748689240.0,"tbf es ist schon eine Weile her seitdem ich die das letzte Mal gekauft habe (sind halt teuer), aber ich bin positiv, dass die nicht so verdammt klein waren. ",https://reddit.com/r/MogelPackung/comments/1kzuejb/229_für_vier_von_diesen_minidingern/
1kzanvt,Wo ist Nr. 4,0,0.21,Scrummle223,15,1748627292.0,"Laut Packung 2+1 (jaja....+ 1 am Arsch)
Obwohl der Platz für Nr.4 schon reserviert ist.
",https://reddit.com/r/MogelPackung/comments/1kzanvt/wo_ist_nr_4/
1kz2d6h,"Packung 4x so groß, wie es nötig wär",114,0.85,New_Phrase_4528,56,1748606273.0,,https://reddit.com/r/MogelPackung/comments/1kz2d6h/packung_4x_so_groß_wie_es_nötig_wär/
1kyy5ns,Mondelez-Milka Schokolade,31,0.78,Background-Reader,49,1748590059.0,"Quelle: https://www.watson.de/leben/geld-shopping/827441894-milka-bringt-schokoladen-tafeln-in-neuer-groesse-auf-den-markt

Ich finde es einfach nur noch dreist und schade zugleich. 
Die 300g Tafel war immer etwas besonderes. Nicht nur weil man sie sich gut einteilen konnte bei der Menge.
Dann kam die erste Abzocke. Aus den einst 300g wurden 250g bei gleichem Preis! 
Knapp 5,-€ für 250g Schokolade. 
Einfach um 50g betrogen.
Weil die bei Mondelez aber nur Dollarzeichen in den Augen haben und über geringe Absätze klagen, kamen die auf eine noch bessere Idee. 
„Wir nennen die Schokolade ab jetzt Milka Extra und reduzieren nochmals runter auf 190g“.
Das ganze dann für knappe 4,-€!
Sorry, aber da vergeht mir so dermaßen der Genuss auf ein schönes Stück Schokolade.

Ich unterstütze diesen Unsinn nicht und meide nun die gute Milka Schokolade. Auch wenn es mir schwer fällt. Aber für mich persönlich steht das in keinem guten Preis/Leistungs Verhältnis mehr. ",https://reddit.com/r/MogelPackung/comments/1kyy5ns/mondelezmilka_schokolade/
1kyewvr,Auf nix ist mehr Verlass,30,0.74,Comieter,31,1748535412.0,Geht das als Mogelpackung durch?,https://reddit.com/r/MogelPackung/comments/1kyewvr/auf_nix_ist_mehr_verlass/
1kyanyh,Haste doch direkt schon kein Bock mehr,100,0.85,charleeeeey12,54,1748524942.0,,https://reddit.com/r/MogelPackung/comments/1kyanyh/haste_doch_direkt_schon_kein_bock_mehr/
1kxd4de,"Schmeckt gut, aber...",18,0.66,schaukelwurmv,35,1748426010.0,"... nichtmal 6 Stück drin. Und es ist noch nichtmal Schokolade drin, nur so ne, Zitat, ""Halbschokolade"". Seufz. Schmeckt trotzdem gut. ",https://reddit.com/r/MogelPackung/comments/1kxd4de/schmeckt_gut_aber/
1kwxblu,Entmogelung: Clarkys schrumpft Verpackung statt Inhalt!,283,0.99,0xmarcel,20,1748376352.0,"Gleiches Gewicht (200g), aber plötzlich ist die Packung geschrumpft. Danke Clarkys - endlich mal Ehrlichkeit in der Verpackungsgröße!",https://reddit.com/r/MogelPackung/comments/1kwxblu/entmogelung_clarkys_schrumpft_verpackung_statt/
1kwlpj7,🥲,92,0.86,Equivalent_Daikon760,35,1748348056.0,Balea Augen roll-on von dm,https://reddit.com/r/MogelPackung/comments/1kwlpj7/_/
1kvwcp3,Doppelt gemogelt,80,0.92,marius_knaus,17,1748271203.0,"Überpackung - Verpackung - Produkt.
Und immer wirds ein bissel kleiner. 😐",https://reddit.com/r/MogelPackung/comments/1kvwcp3/doppelt_gemogelt/
1kvlmyc,Zählt das ?,0,0.07,mtglover1335,8,1748233904.0,Bio Bacon zum Braten enthält Natriumnitrit ?,https://reddit.com/r/MogelPackung/comments/1kvlmyc/zählt_das/
1ku95d0,Oreo Wafer roll,80,0.91,Powerful_Cap9401,32,1748085112.0,"Abgesehen davon das da noch locker 2 Packungen platz hätten:
Das Bild in kombination mit „vanilla cream“ suggeriert mir schon, das die Waffel gefüllt ist.",https://reddit.com/r/MogelPackung/comments/1ku95d0/oreo_wafer_roll/
1ku5by1,Hochdosiert,2,0.54,henrikh1998,13,1748069230.0,"Muss aktuell Calcium ergänzen, stand vorm Regal und dachte mir ich gönne mir mal die Tabletten mit der höchsten Dosis...
Kosten aufs Kilogramm ca. das Doppelte von No-Name 600mg Tabletten...",https://reddit.com/r/MogelPackung/comments/1ku5by1/hochdosiert/
1ku4rkz,Chio Dip vs. Fuego Dip,14,0.65,SamVimes78,41,1748066957.0,"Hier mal eine Mogelpackung, wie sie klassischer nicht sein könn:te Chio benutzt ohne Not bei gleichem Inhalt deutlich größere Gläser als der Mitbewerber. Man vermutet auf den ersten Blick mehr Inhalt.

Die Gläser sehen immer randvoll aus. Vermutlich weil während der Produktion bzw. Des Transports der Inhalt öffentlich herumschwappt.

Das Chio Dip Glas ist trotz gleichen Inhalts deutlich größer. Und natürlich auch teurer. Hier lohnt sich ein Blick auf den Kilopreis, sonst würde man intuitiv zum größeren Glas greifen und mehr Inhalt erwarten.

Dass nicht nur Gewicht, sondern auch Volumen beider Dips identisch sind, sieht man im letzten Bild. Ich habe tatsächlich zunächst vermutet, dass der Dip von Fuego schwerer sein könnte und der von Chio evtl gestreckt ist. Tatsächlich wäre mir ein dünner, leichterer Dip lieber gewesen.

Gekauft habe ich am Ende die Eigenmarke des Supermarkts.

Und Nein! Wir stehen jetzt hier nicht über Geschmack oder Qualität der verschiedenen Dips!",https://reddit.com/r/MogelPackung/comments/1ku4rkz/chio_dip_vs_fuego_dip/
1ktowo2,Fish o Filet,2,0.52,impatiently-waiting1,33,1748020182.0,"Ich könnte schwören, der war mal größer... 🧐",https://reddit.com/r/MogelPackung/comments/1ktowo2/fish_o_filet/
1ktj7l5,Aua,0,0.36,Interesting-Western6,15,1748005863.0,"Muss das Zeug nehmen da ich vor 2 Tagen ne OP hatte.
Giga Packung, giga Hülle und die Mini Tablette in der Mitte.
Fast 24€ das Zeug",https://reddit.com/r/MogelPackung/comments/1ktj7l5/aua/
1ktepuy,Zählt das ?,121,0.91,Inevitable-Boot-8611,30,1747990197.0,,https://reddit.com/r/MogelPackung/comments/1ktepuy/zählt_das/
1ktcgpl,Was da wohl schief gelaufen ist?,0,0.43,raksooooo,20,1747980657.0,,https://reddit.com/r/MogelPackung/comments/1ktcgpl/was_da_wohl_schief_gelaufen_ist/
1ksvviz,Und der Deckel lacht mich auch noch so schadenfroh an…,153,0.93,GiveMe1Dollar,25,1747933211.0,,https://reddit.com/r/MogelPackung/comments/1ksvviz/und_der_deckel_lacht_mich_auch_noch_so/
1kssu73,Irreführend: Langnese Magnum,267,0.73,HuntingDog_Skaface,99,1747925883.0,"Wohl keine richtige Mogelpackung, aber durchaus irreführende Beschriftung. Auf der Seite gestapelt, glaubt man bei flüchtigem Hinschauen an 9 Eis in der Packung.",https://reddit.com/r/MogelPackung/comments/1kssu73/irreführend_langnese_magnum/
1ksjd8v,Warum hat Biomais bei gleichen Abtropfgewicht ein höheres Gesamtgewicht?,20,0.76,Generalvollmacht,34,1747892998.0,"Moin,
es geht nicht um eine Mogelpackung, aber ich denke, da es hier generell viel um Verpackungseinheiten geht, dass ich hier am ehesten eine Antwort erhalte. 
Weiß jemand warum Biomais ""größer"" verpackt wird? Gibt es dafür eine sinnvolle Erklärung?",https://reddit.com/r/MogelPackung/comments/1ksjd8v/warum_hat_biomais_bei_gleichen_abtropfgewicht_ein/
1ks8ff1,Langnese Flutschfinger ohne Flutschfinger,19,0.79,zedernmann,11,1747859799.0,"Wollte mir grade meinen letzten Flutschi snacken. Musste extrem enttäuscht feststellen, dass diese Packung leer ist. Sie ist zu und da ist etwas Luft drinnen. Mehr nicht. Leider weiß ich nicht, wie ich das eindeutiger fotografieren soll, dass die Verpackung unbeschädigt ist.
Ich bin jetzt traurig.",https://reddit.com/r/MogelPackung/comments/1ks8ff1/langnese_flutschfinger_ohne_flutschfinger/
1ks37id,😳Creamy ?,25,0.96,666selin666,6,1747847289.0,,https://reddit.com/r/MogelPackung/comments/1ks37id/creamy/
1ks078x,Mal was neues,29,0.83,Dr_Gruselglatz,16,1747840119.0,"Mir kam die Packung irgendwie nicht richtig vor vom Gewicht her. Dann ab auf die Waage damit. Tja, kann wohl mal passieren. Danke Spar",https://reddit.com/r/MogelPackung/comments/1ks078x/mal_was_neues/
1kroe16,15 Cent für den Klecks Senf?,34,0.89,threegreen89,12,1747798944.0,,https://reddit.com/r/MogelPackung/comments/1kroe16/15_cent_für_den_klecks_senf/
1kra6w8,Welches der beiden Packungen hat denn nun mehr drin?,0,0.48,DanDon-2020,21,1747760727.0,"Links als Gewichtsangabe, rechts in Stückzahl auf dem Preisschild.",https://reddit.com/r/MogelPackung/comments/1kra6w8/welches_der_beiden_packungen_hat_denn_nun_mehr/
1kra192,Ist zwar keine Mogelpackung aber interessant wie man es übertreiben kann,3,0.57,DanDon-2020,3,1747760375.0,,https://reddit.com/r/MogelPackung/comments/1kra192/ist_zwar_keine_mogelpackung_aber_interessant_wie/
1kr7670,Sardellenfilets von Aldi,18,0.82,niminiable,29,1747753546.0,,https://reddit.com/r/MogelPackung/comments/1kr7670/sardellenfilets_von_aldi/
1kr2xio,Putenfleisch von Rewe,2221,0.96,ComprehensiveCard552,339,1747741948.0,Gestern 2 Packungen davon im Rewe gekauft. Bei beiden ca. 200 gr. zu wenig Inhalt.,https://reddit.com/r/MogelPackung/comments/1kr2xio/putenfleisch_von_rewe/
1kqymzn,"Salami/Käse-Brötchen. Fair, es nach Käse zu benennen.",234,0.97,IllustriousUmpire367,69,1747724741.0,"3,50€ am Schulkiosk.. ich bin ehrlich gesagt zwiespältig ob das hier nicht schon Betrug ist.",https://reddit.com/r/MogelPackung/comments/1kqymzn/salamikäsebrötchen_fair_es_nach_käse_zu_benennen/
1kqy5jn,Enjoying my cone until I got to the middle and it was empty. The clerk told me this is how they were trained to serve ice cream,18,0.75,Anon_Afg_Ind,18,1747722714.0,,https://reddit.com/r/MogelPackung/comments/1kqy5jn/enjoying_my_cone_until_i_got_to_the_middle_and_it/
1kpgjed,Zählt das auch als Packung? Gesehen bei McDonald's,192,0.93,vonBlankenburg,58,1747562749.0,,https://reddit.com/r/MogelPackung/comments/1kpgjed/zählt_das_auch_als_packung_gesehen_bei_mcdonalds/
1kpfw5k,Made in...,261,0.95,Patgific,26,1747560011.0,,https://reddit.com/r/MogelPackung/comments/1kpfw5k/made_in/
1kp4dhx,Optische oder offensichtliche Täuschung?,0,0.35,Initial-Top7828,14,1747518857.0,"Hallo miteinander,

dieser Anblick hat mich vorhin doch irritiert. Auf den ersten Blick schien es gar nicht möglich zu sein, auch fühlte sich die linke Flasche schwerer an als die rechte. Was täuscht hier wen? Liegt es wirklich nur am Design der Flaschen? ",https://reddit.com/r/MogelPackung/comments/1kp4dhx/optische_oder_offensichtliche_täuschung/
